{
  "paper_id": "paper_hanlon_2025_jama",
  "doi": "10.1001/jama.2024.27402",
  "title": "Effectiveness of glucose-lowering drugs in older adults with type 2 diabetes: a network meta-analysis",
  "authors": [
    "Hanlon et al."
  ],
  "journal": "JAMA",
  "year": 2025,
  "source_type": "journal_article",
  "open_access": true
}
